{
  "schema_version": "router-contract.v1",
  "model_mode": "laguna_m_router",
  "user_goal": "Analyze production 5xx error log to identify failure patterns and root cause, then address code quality issues in the API handler that complicate debugging.",
  "candidate_skills": [
    "ci-log-reducer",
    "code-quality-refactorer"
  ],
  "routing_decision": {
    "chosen_skill": "ci-log-reducer",
    "reason": "P0 production incident with 18% error rate requires immediate log analysis to guide incident response; code quality refactoring in api/handler.ts is important but non-urgent and deferred until incident is resolved."
  },
  "delegations": [
    {
      "worker_model": "laguna_xs",
      "task_contract": {
        "schema_version": "task-contract.v1",
        "model_mode": "laguna_xs_worker",
        "task_type": "log_reduction",
        "goal": "Reduce logs/error-5xx.log to a structured failure summary identifying error patterns and root cause.",
        "context_packet": {
          "files": [
            {
              "path": "incident-report.md",
              "why": "P0 incident context: 5xx spike at 08:45 UTC, 18% error rate, customer impact"
            },
            {
              "path": "logs/error-5xx.log",
              "why": "production error log showing mix of upstream timeouts, auth failures, and rate limit errors"
            }
          ],
          "commands": [],
          "logs": [
            "logs/error-5xx.log"
          ]
        },
        "scope": {
          "paths": [
            "logs/error-5xx.log"
          ],
          "max_files_to_modify": 0
        },
        "constraints": {
          "output_format": "json",
          "artifact_path": ".laguna/error-5xx-summary.json",
          "must_not": [
            "modify repository files",
            "invent log lines not present in the source",
            "speculate on fixes before analysis is complete"
          ]
        },
        "acceptance": {
          "checks": [
            {
              "type": "command",
              "command": "test -f .laguna/error-5xx-summary.json"
            },
            {
              "type": "command",
              "command": "jq -e '.error_patterns | length > 0' .laguna/error-5xx-summary.json"
            }
          ]
        },
        "repair_policy": {
          "max_repairs": 1,
          "return_only_corrected_output": true
        },
        "escalation": "stop_and_report"
      }
    }
  ],
  "stop_conditions": [
    "validator_passed",
    "escalation_required"
  ]
}
